{
  "election_id": "20160413",
  "office": "assembly/daejeon-junggu-20",
  "candidate": {
    "name": "이은권",
    "party_id": "saenuridang",
    "person_id": "i-eungwon-1957",
    "nec_huboid": "100118667"
  },
  "pledges": [
    {
      "id": "20-daejeon-junggu-01",
      "title": "대전의 상징, 보문타워 건립으로 중부권 최대 관광거점 지구조성",
      "page": 10
    },
    {
      "id": "20-daejeon-junggu-02",
      "title": "구)충남도청사 부지를 문화예술창조 집적단지로 조성, 원도심 부활의 전기 마련",
      "page": 10
    },
    {
      "id": "20-daejeon-junggu-03",
      "title": "사통팔달 교통망 구축으로 편리한 접근성 확보",
      "page": 10
    },
    {
      "id": "20-daejeon-junggu-04",
      "title": "민생우선, 민생복지 최우선으로 청춘의 열정이 넘치는 따뜻한 대한민국 건설",
      "page": 10
    }
  ],
  "source_urls": [
    "https://policy.nec.go.kr/policy_pdf/20160413/PDF/PBINFO_PUB/3002/003_100118667_20191105_1.pdf"
  ],
  "verified": false,
  "checked_at": "2026-11-01",
  "note": "제20대 국회의원선거 대전 중구 당선인 이은권 (새누리당). 책자형 선거공보 PDF 10쪽 분야별 공약의 파란 띠 제목 4개. 제목 아래 ● 세부 항목은 넣지 않았다. PDF 9쪽 「해내겠습니다! 대전의 상징, 보문타워 건립!」은 10쪽 첫 제목과 같은 공약을 크게 보여 주는 표지라 따로 넣지 않았고, PDF 5–6쪽 중구청장 시절 성과도 넣지 않았다. 제목은 원문 문구를 따랐고 바꾼 것은 위에 적은 구호·수식어 덜어내기뿐이다. 이행 여부는 판정하지 않았다."
}
