{
  "election_id": "20240410",
  "office": "assembly/nec-20816423",
  "candidate": {
    "name": "김영진",
    "party_id": "deobureo-minjudang",
    "person_id": null,
    "nec_huboid": "100152714"
  },
  "pledges": [
    {
      "id": "22-gyeonggi-suwon-c-01",
      "title": "사통팔달 교통 신도시 완성",
      "page": null
    },
    {
      "id": "22-gyeonggi-suwon-c-02",
      "title": "서울 강남 생활권 신도시 완성",
      "page": null
    },
    {
      "id": "22-gyeonggi-suwon-c-03",
      "title": "동서 균형발전 신도시 완성",
      "page": null
    },
    {
      "id": "22-gyeonggi-suwon-c-04",
      "title": "첨단혁신경제 신도시 완성",
      "page": null
    },
    {
      "id": "22-gyeonggi-suwon-c-05",
      "title": "문화/콘텐츠/관광 신도시 완성",
      "page": null
    },
    {
      "id": "22-gyeonggi-suwon-c-06",
      "title": "원도심 재개발로 주거 신도시 완성",
      "page": null
    },
    {
      "id": "22-gyeonggi-suwon-c-07",
      "title": "청년 창업지원 청년 신도시 완성",
      "page": null
    },
    {
      "id": "22-gyeonggi-suwon-c-08",
      "title": "365일 안전 신도시 완성",
      "page": null
    },
    {
      "id": "22-gyeonggi-suwon-c-09",
      "title": "아기 키우기 좋은 교육 신도시 완성",
      "page": null
    },
    {
      "id": "22-gyeonggi-suwon-c-10",
      "title": "특례시 행정 신도시 완성",
      "page": null
    }
  ],
  "source_urls": [
    "https://policy.nec.go.kr/policy_pdf/20240410/PDF/PBINFO_PUB/4103/003_100152714_20240403_2.pdf"
  ],
  "verified": false,
  "checked_at": "2026-09-27",
  "note": "제22대 국회의원선거 경기 수원시 병 당선인 김영진 (더불어민주당). 책자형 선거공보 PDF 5쪽(펼침면) 「김영진이 시작한 변화와 발전, 김영진이 완성하게 해주십시오!」 01–10의 제목줄. 각 제목 아래 설명 줄(예: 01 아래 신분당선 연장선·GTX-C 조기 개통 등)은 넣지 않았다. 같은 쪽 아래의 「동별 주요공약」, PDF 2–4쪽의 지난 임기 실적, PDF 6쪽의 더불어민주당 5대 국가비전은 넣지 않았다. 끝의 !만 덜어냈다. 제목은 원문 문구를 따랐고 바꾼 것은 위에 적은 구호·수식어 덜어내기뿐이다. 분류(category)는 앱에 정해진 분류 체계가 없어 비워 두었다. 이행 여부는 판정하지 않았다(notJudged)."
}
