{
  "election_id": "20240410",
  "office": "assembly/nec-5b07fc37",
  "candidate": {
    "name": "박대출",
    "party_id": "gungminui-him",
    "person_id": "bak-daechul-1961",
    "nec_huboid": "100152845"
  },
  "pledges": [
    {
      "id": "22-gyeongnam-jinju-a-01",
      "title": "「우주항공복합도시 특별법」 관철",
      "page": null
    },
    {
      "id": "22-gyeongnam-jinju-a-02",
      "title": "‘국도 33호선’ 우회도로(정촌~사천) 개설 추진",
      "page": null
    },
    {
      "id": "22-gyeongnam-jinju-a-03",
      "title": "우주항공산업 전문인력 양성",
      "page": null
    },
    {
      "id": "22-gyeongnam-jinju-a-04",
      "title": "우주항공 3D 프린팅 융합기술센터 추진",
      "page": null
    },
    {
      "id": "22-gyeongnam-jinju-a-05",
      "title": "민·군 겸용 우주·항공 소재 인증지원센터 설립 추진",
      "page": null
    },
    {
      "id": "22-gyeongnam-jinju-a-06",
      "title": "우주항공 관련 기업 유치",
      "page": null
    },
    {
      "id": "22-gyeongnam-jinju-a-07",
      "title": "공립 항공우주분야 전문과학관 건설 예산 확보",
      "page": null
    },
    {
      "id": "22-gyeongnam-jinju-a-08",
      "title": "항공기 엔진 기술 국산화 지원",
      "page": null
    },
    {
      "id": "22-gyeongnam-jinju-a-09",
      "title": "진주 미래항공기체(AAV) 실증센터 구축",
      "page": null
    },
    {
      "id": "22-gyeongnam-jinju-a-10",
      "title": "국립공원공단 동부지역본부 완성",
      "page": null
    },
    {
      "id": "22-gyeongnam-jinju-a-11",
      "title": "금곡(금곡중 부지) 국토안전실증센터 설립 추진",
      "page": null
    },
    {
      "id": "22-gyeongnam-jinju-a-12",
      "title": "국립 ‘남부권 산불방지센터(가칭)’ 유치 추진",
      "page": null
    },
    {
      "id": "22-gyeongnam-jinju-a-13",
      "title": "신진주역세권 초·중통합학교 완성",
      "page": null
    },
    {
      "id": "22-gyeongnam-jinju-a-14",
      "title": "진주교대 부설초등학교 전면 리모델링 및 증축",
      "page": null
    },
    {
      "id": "22-gyeongnam-jinju-a-15",
      "title": "혁신고등학교(가칭) 설립 조기확정 추진",
      "page": null
    },
    {
      "id": "22-gyeongnam-jinju-a-16",
      "title": "진주 초중고 교육환경개선위한 교육특교금 확보",
      "page": null
    },
    {
      "id": "22-gyeongnam-jinju-a-17",
      "title": "진주지역 대학교 보건의료 정원 증원 추진",
      "page": null
    },
    {
      "id": "22-gyeongnam-jinju-a-18",
      "title": "수곡 체육공원 조성 추진",
      "page": null
    },
    {
      "id": "22-gyeongnam-jinju-a-19",
      "title": "신안·이현 복합스포츠타운 완성",
      "page": null
    },
    {
      "id": "22-gyeongnam-jinju-a-20",
      "title": "내동 스포츠가치센터 요금인하 및 주말운영 추진",
      "page": null
    },
    {
      "id": "22-gyeongnam-jinju-a-21",
      "title": "시민 생활체육시설 확대(금곡 파크골프장, 족구 에어돔, 석갑산 배드민턴 구장 등)",
      "page": null
    },
    {
      "id": "22-gyeongnam-jinju-a-22",
      "title": "망경 한보A 앞 쉼터공원 조성",
      "page": null
    },
    {
      "id": "22-gyeongnam-jinju-a-23",
      "title": "성북 구)영남백화점 복합 아동복지센터 완성",
      "page": null
    },
    {
      "id": "22-gyeongnam-jinju-a-24",
      "title": "진주세무서 앞 ‘걷고 싶은 거리’ 조성 추진",
      "page": null
    },
    {
      "id": "22-gyeongnam-jinju-a-25",
      "title": "첨단 가속기 의료센터 구축 추진",
      "page": null
    },
    {
      "id": "22-gyeongnam-jinju-a-26",
      "title": "평거·판문 등 복합문화공간 조성 추진",
      "page": null
    },
    {
      "id": "22-gyeongnam-jinju-a-27",
      "title": "‘대한민국 기업가정신관’ 건립 추진",
      "page": null
    },
    {
      "id": "22-gyeongnam-jinju-a-28",
      "title": "신진주역세권 문화센터 건립 추진",
      "page": null
    },
    {
      "id": "22-gyeongnam-jinju-a-29",
      "title": "진주문화원 독립운영 원사 확보 추진",
      "page": null
    },
    {
      "id": "22-gyeongnam-jinju-a-30",
      "title": "수곡(원당초교 부지) 딸기 테마존 건립 추진",
      "page": null
    },
    {
      "id": "22-gyeongnam-jinju-a-31",
      "title": "산림청 ‘목재친화도시’ 유치",
      "page": null
    },
    {
      "id": "22-gyeongnam-jinju-a-32",
      "title": "광역시·도 최초의 ‘제2음악창작소’ 진주 유치",
      "page": null
    },
    {
      "id": "22-gyeongnam-jinju-a-33",
      "title": "KTX 남부내륙철도 ‘신속 완공’ 위한 적정성재검토 조기완료",
      "page": null
    },
    {
      "id": "22-gyeongnam-jinju-a-34",
      "title": "진주 KTX 및 SRT 증차 추진",
      "page": null
    },
    {
      "id": "22-gyeongnam-jinju-a-35",
      "title": "사천공항 운항편 증편 추진",
      "page": null
    },
    {
      "id": "22-gyeongnam-jinju-a-36",
      "title": "천전동 약골 진입로 확장",
      "page": null
    },
    {
      "id": "22-gyeongnam-jinju-a-37",
      "title": "산모·태아 위한 정책보험 도입 등 정부지원 추진",
      "page": null
    },
    {
      "id": "22-gyeongnam-jinju-a-38",
      "title": "난임 부부 의료비 경감 위한 정부지원 추진",
      "page": null
    },
    {
      "id": "22-gyeongnam-jinju-a-39",
      "title": "‘청년 도전사업’ 프로그램 확대 추진",
      "page": null
    },
    {
      "id": "22-gyeongnam-jinju-a-40",
      "title": "한국장애인고용공단 경남서부지사 완성",
      "page": null
    },
    {
      "id": "22-gyeongnam-jinju-a-41",
      "title": "장애인 일자리 위한 ‘장애인 표준사업장’ 구축",
      "page": null
    },
    {
      "id": "22-gyeongnam-jinju-a-42",
      "title": "명석, 신안 경로당 등 어르신 복지센터 건립 추진",
      "page": null
    },
    {
      "id": "22-gyeongnam-jinju-a-43",
      "title": "명석 공동 생활복지센터 조성 추진",
      "page": null
    },
    {
      "id": "22-gyeongnam-jinju-a-44",
      "title": "한국승강기안전공단 정부예산 증액 추진",
      "page": null
    },
    {
      "id": "22-gyeongnam-jinju-a-45",
      "title": "LH 및 세라믹기술원 공동기숙사 설치 추진",
      "page": null
    },
    {
      "id": "22-gyeongnam-jinju-a-46",
      "title": "한국산업기술시험원 증원 추진",
      "page": null
    },
    {
      "id": "22-gyeongnam-jinju-a-47",
      "title": "중진공·국토안전관리원 등 기관별 청사 순차적 신축·증축 추진",
      "page": null
    },
    {
      "id": "22-gyeongnam-jinju-a-48",
      "title": "국방기술품질원 등 방산 관련 연구·개발 인력 처우개선 추진",
      "page": null
    },
    {
      "id": "22-gyeongnam-jinju-a-49",
      "title": "순직 경찰·소방·군인 ‘추서 계급’ 기준 유족연금 지급 추진",
      "page": null
    },
    {
      "id": "22-gyeongnam-jinju-a-50",
      "title": "LH ‘적정 정원’ 확보 등 협력 강화",
      "page": null
    },
    {
      "id": "22-gyeongnam-jinju-a-51",
      "title": "최전방 부대 ‘무인PX’ 설치 확대",
      "page": null
    },
    {
      "id": "22-gyeongnam-jinju-a-52",
      "title": "혁신도시 아파트 단지주변 신호위반 단속장비 등 교통안전시설 확충",
      "page": null
    },
    {
      "id": "22-gyeongnam-jinju-a-53",
      "title": "농촌지역 범죄예방 지능형 CCTV 확대 설치",
      "page": null
    },
    {
      "id": "22-gyeongnam-jinju-a-54",
      "title": "나불천 관지세월교 재가설 추진",
      "page": null
    },
    {
      "id": "22-gyeongnam-jinju-a-55",
      "title": "천전 지구대·119안전센터 등 경찰·소방 노후 시설 개선 추진",
      "page": null
    },
    {
      "id": "22-gyeongnam-jinju-a-56",
      "title": "행정안전부 안전교부세 대규모 확보",
      "page": null
    },
    {
      "id": "22-gyeongnam-jinju-a-57",
      "title": "성북·강남지구 도시재생 뉴딜사업 완성",
      "page": null
    },
    {
      "id": "22-gyeongnam-jinju-a-58",
      "title": "대평 배수펌프장 개선 사업 추진",
      "page": null
    },
    {
      "id": "22-gyeongnam-jinju-a-59",
      "title": "문산 쑥밭들 배수로 정비사업 추진",
      "page": null
    },
    {
      "id": "22-gyeongnam-jinju-a-60",
      "title": "수곡 하수종말처리장 추진",
      "page": null
    },
    {
      "id": "22-gyeongnam-jinju-a-61",
      "title": "농촌·소상공인 인력 확충 위한 외국인근로자(E9비자) 입국 확대 추진",
      "page": null
    },
    {
      "id": "22-gyeongnam-jinju-a-62",
      "title": "‘농작물 재해보험’ 개선 추진",
      "page": null
    }
  ],
  "source_urls": [
    "https://policy.nec.go.kr/policy_pdf/20240410/PDF/PBINFO_PUB/4803/003_100152845_20240402_3.pdf"
  ],
  "verified": false,
  "checked_at": "2026-09-28",
  "note": "제22대 국회의원선거 경남 진주시 갑 당선인 박대출 (국민의힘). 책자형 선거공보 PDF 6쪽 「천년대계 우주항공도시! 박대출의 새로운 비전」 ☑ 9개와 PDF 9–10쪽 「진주의 밝고 따뜻한 미래」·「박대출이 촘촘하고 힘있게 이어가겠습니다」 8개 분야 ☑ 항목 53개(쪽 이미지 기준 왼쪽 위 상자부터). 각 항목 아래 • 설명, 분야 제목, 실적과 추진 사업이 섞인 PDF 7–8쪽 바이오·문화 인프라 쪽, 2–5쪽 실적은 넣지 않았다. 괄호는 원문대로 두었다. 제목은 원문 문구를 따랐고 바꾼 것은 위에 적은 구호·수식어 덜어내기뿐이다. 분류(category)는 앱에 정해진 분류 체계가 없어 비워 두었다. 이행 여부는 판정하지 않았다(notJudged)."
}
