{
  "election_id": "20200415",
  "office": "assembly/busan-suyeonggu-21",
  "candidate": {
    "name": "전봉민",
    "party_id": "mirae-tonghapdang",
    "person_id": "jeon-bongmin-1972",
    "nec_huboid": "100137475"
  },
  "pledges": [
    {
      "id": "21-busan-suyeonggu-01",
      "title": "‘수영강 휴먼브릿지’ 건립",
      "page": 9
    },
    {
      "id": "21-busan-suyeonggu-02",
      "title": "‘수영문화회관’ 건립 추진",
      "page": 9
    },
    {
      "id": "21-busan-suyeonggu-03",
      "title": "‘제2수영국민스포츠문화타운’ 조성 추진",
      "page": 9
    },
    {
      "id": "21-busan-suyeonggu-04",
      "title": "‘다함께 돌봄센터’ 모든 동별 건립 추진",
      "page": 10
    },
    {
      "id": "21-busan-suyeonggu-05",
      "title": "반려동물과 함께하는 ‘펫파크’ 조성 추진",
      "page": 10
    },
    {
      "id": "21-busan-suyeonggu-06",
      "title": "주민건강· 복지시설 확충",
      "page": 10
    }
  ],
  "source_urls": [
    "https://policy.nec.go.kr/policy_pdf/20200415/PDF/PBINFO_PUB/2615/003_100137475_20200415_2.pdf"
  ],
  "verified": false,
  "checked_at": "2026-11-01",
  "note": "제21대 국회의원선거 부산 수영구 당선인 전봉민 (미래통합당). 책자형 선거공보 PDF 9–10쪽 「누구나 살고 싶은 수영구 더욱 더 키워가고 싶습니다!」 공약 제목 6개. 첫 제목 앞의 구호 「수영~센텀을 하나로 만들겠습니다!」는 덜어냈다. 제목 아래 ▷ 세부 항목, PDF 7–8쪽 방역·부산경제·보육 등 전국 단위 공약, PDF 6쪽 시의원 시절 추진 사업, PDF 3·5쪽 의정 활동은 넣지 않았다. 제목은 원문 문구를 따랐고 바꾼 것은 위에 적은 구호·수식어 덜어내기뿐이다. 이행 여부는 판정하지 않았다."
}
