{
  "election_id": "20200415",
  "office": "assembly/incheon-seogugap-21",
  "candidate": {
    "name": "김교흥",
    "party_id": "deobureo-minjudang",
    "person_id": "gim-gyoheung-1960",
    "nec_huboid": "100134948"
  },
  "pledges": [
    {
      "id": "21-incheon-seogugap-01",
      "title": "(환경) 푸른하늘, 맑은 서구",
      "page": 9
    },
    {
      "id": "21-incheon-seogugap-02",
      "title": "(교통) 서울까지 20분대, 교통혁명 중심 서구",
      "page": 9
    },
    {
      "id": "21-incheon-seogugap-03",
      "title": "(교육) 빛나는 미래, 교육 1번지 서구",
      "page": 9
    },
    {
      "id": "21-incheon-seogugap-04",
      "title": "(문화) 함께 즐기는 문화, 꿈꾸는 서구",
      "page": 10
    },
    {
      "id": "21-incheon-seogugap-05",
      "title": "(체육) 생활체육 중심도시 서구",
      "page": 10
    },
    {
      "id": "21-incheon-seogugap-06",
      "title": "(도시) 글로벌 혁신도시 서구",
      "page": 10
    }
  ],
  "source_urls": [
    "https://policy.nec.go.kr/policy_pdf/20200415/PDF/PBINFO_PUB/2808/003_100134948_20200415_2.pdf"
  ],
  "verified": false,
  "checked_at": "2026-11-01",
  "note": "제21대 국회의원선거 인천 서구갑 당선인 김교흥 (더불어민주당). 책자형 선거공보 PDF 9–10쪽 「서구 발전 6대 비전」 제목 6개. 제목 아래 ▶ 세부 항목, PDF 7–8쪽 경인고속도로 일반화 구간 지도와 공영주차장 표, PDF 5–6쪽 「서구를 위한 약속」(민주당 전국 공약을 서구에 맞춘 분야별 약속), PDF 4쪽 지난 활동은 넣지 않았다. 제목은 원문 문구를 따랐고 바꾼 것은 위에 적은 구호·수식어 덜어내기뿐이다. 이행 여부는 판정하지 않았다."
}
